{
	"ready": true,
	"pathHitmanRuntime": "D:/EpicGames/HITMAN3/Runtime",
	"pathRpkgCli": "D:/Dev/hitman3/rpkg/rpkg-cli.exe",
	"pathOresTool": "D:/Dev/hitman3/rpkg/OREStool.exe",
	"inputPatch": 2,
	"outputPatch": 47,
	"replaceAmount": 100,
	"useGetAllItem": true,
	"getAllItemId": "TOKEN_FIBERWIRE",
	"replaceAllAmount": 1,
	"affectAllItems": true,
	"affect": [
		{
			"type": "weapon",
			"subtype": "melee"
		},
		{
			"type": "*",
			"subtype": "tool"
		},
		{
			"type": "*",
			"subtype": "explosive"
		},
		{
			"type": "*",
			"subtype": "distraction"
		},
		{
			"type": "*",
			"subtype": "poison"
		}
	]
}